{
  "engineVersion": "planner-engine/0.1.0",
  "policyVersion": "planning-policy/0.1",
  "inputFingerprint": "planning-input:049948446d99180085a2ffe4220a3368705d9b3a55da90b134ca2e709bb8879a",
  "calculatedAsOf": "2026-09-01T12:00:00.000Z",
  "validUntil": "2026-09-01T18:00:00.000Z",
  "timeZone": "Asia/Jerusalem",
  "weekStart": "2026-08-30T21:00:00.000Z",
  "weekEnd": "2026-09-06T21:00:00.000Z",
  "recommendationState": "NO_PLAN",
  "warningCodes": ["REVIEW_NOT_STARTED"],
  "capacity": {
    "weeklyCapacityMinutes": null,
    "consumedMinutesThisWeek": 0,
    "remainingMinutesThisWeek": null,
    "sessionLimitMinutes": null
  },
  "reviewSummary": {
    "projectionState": "NOT_STARTED",
    "overdueCount": 0,
    "dueTodayCount": 0,
    "validUntil": null
  },
  "nearestDeadline": null,
  "readiness": [],
  "actions": []
}
